{
  "job_id": "rw34-json-child-fixture",
  "claim_id": "RW-34",
  "attempt": 1,
  "role": "leaf",
  "brief_path": "docs/research/swarm-briefs/rw34-json-child-fixture.md",
  "status": "success",
  "empirical_pass_claimed": false,
  "result": {
    "summary": "No-tools JSON child echoed approved excerpts only. This is a route-qualification fixture, not empirical PASS.",
    "findings": [
      {
        "id": "ex1",
        "claim": "Retained excerpt docs/research/swarm-briefs/rw34-json-child-fixture.md digest 4bdcc8efaf09",
        "source_path": "docs/research/swarm-briefs/rw34-json-child-fixture.md"
      }
    ]
  },
  "route_family": "cursor-cloud-json-child",
  "route_model": "json-child"
}
